{
  "$schema": "../../schemas/pay-matrix.schema.json",
  "version": "1.0.0",
  "generatedAt": "2026-08-28",
  "cpc": 7,
  "rule": {
    "multiplier": 1.03,
    "rounding": "nearest-100",
    "description": {
      "en": "Each cell after the first is the previous cell raised by 3 per cent and rounded to the nearest hundred rupees. The first cell of a level is the pre-revised entry pay multiplied by that level's index of rationalisation.",
      "hi": "पहले सेल के बाद प्रत्येक सेल पिछले सेल का 3 प्रतिशत बढ़ाकर निकटतम सौ रुपये तक पूर्णांकित किया गया है। किसी लेवल का पहला सेल पूर्व-संशोधित प्रवेश वेतन को उस लेवल के युक्तिकरण सूचकांक से गुणा करके प्राप्त होता है।"
    },
    "fitmentFactor": 2.57
  },
  "disclaimer": {
    "en": "Reference only; verify with the official gazette/order or your DDO.",
    "hi": "केवल संदर्भ हेतु; आधिकारिक राजपत्र/आदेश अथवा अपने डीडीओ से पुष्टि करें।"
  },
  "levels": [
    {
      "level": "1",
      "order": 1,
      "gradePay": 1800,
      "payBand": {
        "name": "PB-1",
        "range": "5200-20200",
        "preRevisedEntryPay": 7000
      },
      "indexOfRationalisation": 2.57,
      "entryPay": 18000,
      "cells": [
        18000,
        18500,
        19100,
        19700,
        20300,
        20900,
        21500,
        22100,
        22800,
        23500,
        24200,
        24900,
        25600,
        26400,
        27200,
        28000,
        28800,
        29700,
        30600,
        31500,
        32400,
        33400,
        34400,
        35400,
        36500,
        37600,
        38700,
        39900,
        41100,
        42300,
        43600,
        44900,
        46200,
        47600,
        49000,
        50500,
        52000,
        53600,
        55200,
        56900
      ],
      "note": null,
      "source": {
        "name": "CCS (Revised Pay) Rules, 2016 — Schedule, Part A (Pay Matrix)",
        "url": "https://thc.nic.in/Central%20Governmental%20Rules/Central%20Civil%20Services%20(Revised%20Pay)%20Rules,%202016.pdf",
        "reference": "G.S.R. 721(E)",
        "dated": "2016-07-25"
      },
      "fetchedAt": "2026-08-28T07:53:03Z",
      "verify": false
    },
    {
      "level": "2",
      "order": 2,
      "gradePay": 1900,
      "payBand": {
        "name": "PB-1",
        "range": "5200-20200",
        "preRevisedEntryPay": 7730
      },
      "indexOfRationalisation": 2.57,
      "entryPay": 19900,
      "cells": [
        19900,
        20500,
        21100,
        21700,
        22400,
        23100,
        23800,
        24500,
        25200,
        26000,
        26800,
        27600,
        28400,
        29300,
        30200,
        31100,
        32000,
        33000,
        34000,
        35000,
        36100,
        37200,
        38300,
        39400,
        40600,
        41800,
        43100,
        44400,
        45700,
        47100,
        48500,
        50000,
        51500,
        53000,
        54600,
        56200,
        57900,
        59600,
        61400,
        63200
      ],
      "note": null,
      "source": {
        "name": "CCS (Revised Pay) Rules, 2016 — Schedule, Part A (Pay Matrix)",
        "url": "https://thc.nic.in/Central%20Governmental%20Rules/Central%20Civil%20Services%20(Revised%20Pay)%20Rules,%202016.pdf",
        "reference": "G.S.R. 721(E)",
        "dated": "2016-07-25"
      },
      "fetchedAt": "2026-08-28T07:53:03Z",
      "verify": false
    },
    {
      "level": "3",
      "order": 3,
      "gradePay": 2000,
      "payBand": {
        "name": "PB-1",
        "range": "5200-20200",
        "preRevisedEntryPay": 8460
      },
      "indexOfRationalisation": 2.57,
      "entryPay": 21700,
      "cells": [
        21700,
        22400,
        23100,
        23800,
        24500,
        25200,
        26000,
        26800,
        27600,
        28400,
        29300,
        30200,
        31100,
        32000,
        33000,
        34000,
        35000,
        36100,
        37200,
        38300,
        39400,
        40600,
        41800,
        43100,
        44400,
        45700,
        47100,
        48500,
        50000,
        51500,
        53000,
        54600,
        56200,
        57900,
        59600,
        61400,
        63200,
        65100,
        67100,
        69100
      ],
      "note": null,
      "source": {
        "name": "CCS (Revised Pay) Rules, 2016 — Schedule, Part A (Pay Matrix)",
        "url": "https://thc.nic.in/Central%20Governmental%20Rules/Central%20Civil%20Services%20(Revised%20Pay)%20Rules,%202016.pdf",
        "reference": "G.S.R. 721(E)",
        "dated": "2016-07-25"
      },
      "fetchedAt": "2026-08-28T07:53:03Z",
      "verify": false
    },
    {
      "level": "4",
      "order": 4,
      "gradePay": 2400,
      "payBand": {
        "name": "PB-1",
        "range": "5200-20200",
        "preRevisedEntryPay": 9910
      },
      "indexOfRationalisation": 2.57,
      "entryPay": 25500,
      "cells": [
        25500,
        26300,
        27100,
        27900,
        28700,
        29600,
        30500,
        31400,
        32300,
        33300,
        34300,
        35300,
        36400,
        37500,
        38600,
        39800,
        41000,
        42200,
        43500,
        44800,
        46100,
        47500,
        48900,
        50400,
        51900,
        53500,
        55100,
        56800,
        58500,
        60300,
        62100,
        64000,
        65900,
        67900,
        69900,
        72000,
        74200,
        76400,
        78700,
        81100
      ],
      "note": null,
      "source": {
        "name": "CCS (Revised Pay) Rules, 2016 — Schedule, Part A (Pay Matrix)",
        "url": "https://thc.nic.in/Central%20Governmental%20Rules/Central%20Civil%20Services%20(Revised%20Pay)%20Rules,%202016.pdf",
        "reference": "G.S.R. 721(E)",
        "dated": "2016-07-25"
      },
      "fetchedAt": "2026-08-28T07:53:03Z",
      "verify": false
    },
    {
      "level": "5",
      "order": 5,
      "gradePay": 2800,
      "payBand": {
        "name": "PB-1",
        "range": "5200-20200",
        "preRevisedEntryPay": 11360
      },
      "indexOfRationalisation": 2.57,
      "entryPay": 29200,
      "cells": [
        29200,
        30100,
        31000,
        31900,
        32900,
        33900,
        34900,
        35900,
        37000,
        38100,
        39200,
        40400,
        41600,
        42800,
        44100,
        45400,
        46800,
        48200,
        49600,
        51100,
        52600,
        54200,
        55800,
        57500,
        59200,
        61000,
        62800,
        64700,
        66600,
        68600,
        70700,
        72800,
        75000,
        77300,
        79600,
        82000,
        84500,
        87000,
        89600,
        92300
      ],
      "note": null,
      "source": {
        "name": "CCS (Revised Pay) Rules, 2016 — Schedule, Part A (Pay Matrix)",
        "url": "https://thc.nic.in/Central%20Governmental%20Rules/Central%20Civil%20Services%20(Revised%20Pay)%20Rules,%202016.pdf",
        "reference": "G.S.R. 721(E)",
        "dated": "2016-07-25"
      },
      "fetchedAt": "2026-08-28T07:53:03Z",
      "verify": false
    },
    {
      "level": "6",
      "order": 6,
      "gradePay": 4200,
      "payBand": {
        "name": "PB-2",
        "range": "9300-34800",
        "preRevisedEntryPay": 13500
      },
      "indexOfRationalisation": 2.62,
      "entryPay": 35400,
      "cells": [
        35400,
        36500,
        37600,
        38700,
        39900,
        41100,
        42300,
        43600,
        44900,
        46200,
        47600,
        49000,
        50500,
        52000,
        53600,
        55200,
        56900,
        58600,
        60400,
        62200,
        64100,
        66000,
        68000,
        70000,
        72100,
        74300,
        76500,
        78800,
        81200,
        83600,
        86100,
        88700,
        91400,
        94100,
        96900,
        99800,
        102800,
        105900,
        109100,
        112400
      ],
      "note": null,
      "source": {
        "name": "CCS (Revised Pay) Rules, 2016 — Schedule, Part A (Pay Matrix)",
        "url": "https://thc.nic.in/Central%20Governmental%20Rules/Central%20Civil%20Services%20(Revised%20Pay)%20Rules,%202016.pdf",
        "reference": "G.S.R. 721(E)",
        "dated": "2016-07-25"
      },
      "fetchedAt": "2026-08-28T07:53:03Z",
      "verify": false
    },
    {
      "level": "7",
      "order": 7,
      "gradePay": 4600,
      "payBand": {
        "name": "PB-2",
        "range": "9300-34800",
        "preRevisedEntryPay": 17140
      },
      "indexOfRationalisation": 2.62,
      "entryPay": 44900,
      "cells": [
        44900,
        46200,
        47600,
        49000,
        50500,
        52000,
        53600,
        55200,
        56900,
        58600,
        60400,
        62200,
        64100,
        66000,
        68000,
        70000,
        72100,
        74300,
        76500,
        78800,
        81200,
        83600,
        86100,
        88700,
        91400,
        94100,
        96900,
        99800,
        102800,
        105900,
        109100,
        112400,
        115800,
        119300,
        122900,
        126600,
        130400,
        134300,
        138300,
        142400
      ],
      "note": null,
      "source": {
        "name": "CCS (Revised Pay) Rules, 2016 — Schedule, Part A (Pay Matrix)",
        "url": "https://thc.nic.in/Central%20Governmental%20Rules/Central%20Civil%20Services%20(Revised%20Pay)%20Rules,%202016.pdf",
        "reference": "G.S.R. 721(E)",
        "dated": "2016-07-25"
      },
      "fetchedAt": "2026-08-28T07:53:03Z",
      "verify": false
    },
    {
      "level": "8",
      "order": 8,
      "gradePay": 4800,
      "payBand": {
        "name": "PB-2",
        "range": "9300-34800",